{
  "acut_id": "cheap-click-specialist",
  "attempt": 1,
  "error": null,
  "finished_at": "2026-05-09T06:46:11.901217Z",
  "metadata": {
    "skip_apply": true,
    "timeout_seconds": 60,
    "tool": "apply_and_verify",
    "verifier_command": [
      "/Users/chenmohan/gits/barcarolle/experiments/core_narrative/tasks/click/rwork/click__rwork__003/verifier/run.sh"
    ]
  },
  "patch_path": "/Users/chenmohan/gits/barcarolle/experiments/core_narrative/results/raw/codex_nfl_m1_1_structured_20260509__cheap-click-specialist__click__rwork__003__attempt1/missing_noop.patch",
  "review": {
    "mergeability_grade": null,
    "notes": "",
    "rule_violation": false,
    "wrong_module": false
  },
  "run_id": "codex_nfl_m1_1_structured_20260509__cheap-click-specialist__click__rwork__003__attempt1__noop",
  "schema_version": "core-narrative.run-result.v1",
  "split": "rwork",
  "started_at": "2026-05-09T06:46:11.634194Z",
  "status": "failed",
  "task_id": "click__rwork__003",
  "verification": {
    "duration_seconds": 0.267,
    "exit_code": 1,
    "stderr_artifact": "/Users/chenmohan/gits/barcarolle/experiments/core_narrative/results/raw/codex_nfl_m1_1_structured_20260509__cheap-click-specialist__click__rwork__003__attempt1/verifier.stderr.txt",
    "stdout_artifact": "/Users/chenmohan/gits/barcarolle/experiments/core_narrative/results/raw/codex_nfl_m1_1_structured_20260509__cheap-click-specialist__click__rwork__003__attempt1/verifier.stdout.txt"
  }
}
