{
  "acut_id": "cheap-generic-swe",
  "attempt": 1,
  "error": null,
  "finished_at": "2026-05-08T16:27:01.855564Z",
  "metadata": {
    "skip_apply": true,
    "timeout_seconds": 60,
    "tool": "apply_and_verify",
    "verifier_command": [
      "/Users/chenmohan/gits/barcarolle/experiments/core_narrative/tasks/click/rwork/click__rwork__001/verifier/run.sh"
    ]
  },
  "patch_path": "/Users/chenmohan/gits/barcarolle/experiments/core_narrative/results/raw/codex_nfl_rwork_live_uv_20260508__cheap-generic-swe__click__rwork__001__attempt1/missing_noop.patch",
  "review": {
    "mergeability_grade": null,
    "notes": "",
    "rule_violation": false,
    "wrong_module": false
  },
  "run_id": "codex_nfl_rwork_live_uv_20260508__cheap-generic-swe__click__rwork__001__attempt1__noop",
  "schema_version": "core-narrative.run-result.v1",
  "split": "rwork",
  "started_at": "2026-05-08T16:27:01.098849Z",
  "status": "failed",
  "task_id": "click__rwork__001",
  "verification": {
    "duration_seconds": 0.756,
    "exit_code": 4,
    "stderr_artifact": "/Users/chenmohan/gits/barcarolle/experiments/core_narrative/results/raw/codex_nfl_rwork_live_uv_20260508__cheap-generic-swe__click__rwork__001__attempt1/verifier.stderr.txt",
    "stdout_artifact": "/Users/chenmohan/gits/barcarolle/experiments/core_narrative/results/raw/codex_nfl_rwork_live_uv_20260508__cheap-generic-swe__click__rwork__001__attempt1/verifier.stdout.txt"
  }
}
