{
  "acut_id": "cheap-generic-swe",
  "attempt": 1,
  "error": null,
  "finished_at": "2026-05-08T15:53:39.448718Z",
  "metadata": {
    "skip_apply": true,
    "timeout_seconds": 60,
    "tool": "apply_and_verify",
    "verifier_command": [
      "/Users/chenmohan/gits/barcarolle/experiments/core_narrative/tasks/click/rbench/click__rbench__008/verifier/run.sh"
    ]
  },
  "patch_path": "/Users/chenmohan/gits/barcarolle/experiments/core_narrative/results/raw/codex_nfl_click001_008_admission_classified_20260508T2351__click__rbench__008__noop/missing_noop.patch",
  "review": {
    "mergeability_grade": null,
    "notes": "",
    "rule_violation": false,
    "wrong_module": false
  },
  "run_id": "codex_nfl_click001_008_admission_classified_20260508T2351__click__rbench__008__noop__noop",
  "schema_version": "core-narrative.run-result.v1",
  "split": "rbench",
  "started_at": "2026-05-08T15:53:39.073289Z",
  "status": "failed",
  "task_id": "click__rbench__008",
  "verification": {
    "duration_seconds": 0.375,
    "exit_code": 1,
    "stderr_artifact": "/Users/chenmohan/gits/barcarolle/experiments/core_narrative/results/raw/codex_nfl_click001_008_admission_classified_20260508T2351__click__rbench__008__noop/verifier.stderr.txt",
    "stdout_artifact": "/Users/chenmohan/gits/barcarolle/experiments/core_narrative/results/raw/codex_nfl_click001_008_admission_classified_20260508T2351__click__rbench__008__noop/verifier.stdout.txt"
  }
}
