{
  "acut_id": "cheap-generic-swe",
  "attempt": 1,
  "error": null,
  "finished_at": "2026-05-10T10:33:36.884239Z",
  "metadata": {
    "acut_manifest_path": "/Users/chenmohan/gits/barcarolle/experiments/core_narrative/configs/acuts/cheap-generic-swe.yaml",
    "acut_manifest_sha256": "3888ad4d393ac439d8a3d6ea48a7358b4480c6137d2c7aeed9c411cd676513c3",
    "batch_tool": "m2_5_workspace_diff_runner",
    "candidate_patch_sha256": "a56da14f76815a9bd9be5ca801ff65f92fbf9e407ca51eb340dc66d41dcae38c",
    "candidate_patch_size_bytes": 237,
    "clean_patch_replay": {
      "attempted": true,
      "error": null,
      "failure_class": null,
      "runner_workspace": "/Users/chenmohan/gits/barcarolle/experiments/core_narrative/workspaces/m2_5_workspace_diff_synthetic_20260510__cheap-generic-swe__click__rwork__003__attempt1",
      "separate_workspace": true,
      "status": "success",
      "verify_workspace": "/Users/chenmohan/gits/barcarolle/experiments/core_narrative/workspaces/m2_5_workspace_diff_synthetic_20260510__cheap-generic-swe__click__rwork__003__attempt1__verify"
    },
    "failure_class": null,
    "failure_owner": "candidate_patch",
    "mode": "synthetic",
    "model_call_made": false,
    "output_contract": "workspace-diff-v1",
    "patch_readiness": {
      "clean_replay_attempted": true,
      "patch_artifact_persisted": true,
      "patch_size_bytes": 237,
      "verifier_attempt_channel": "verifier_ready_patch_artifact",
      "verifier_ready_patch_available": true
    },
    "schema_version": "core-narrative.m2-5-workspace-diff-v1",
    "skip_apply": false,
    "submission_contract": "workspace-diff-v1",
    "task_manifest_path": "/Users/chenmohan/gits/barcarolle/experiments/core_narrative/tasks/click/rwork/click__rwork__003/task.yaml",
    "task_manifest_sha256": "dbbdc5345b82592bfcd61ff9d61cf1089090447007af9652d3cc90f5be2f849f",
    "timeout_seconds": 60,
    "tool": "apply_and_verify",
    "verifier_artifacts_redacted": false,
    "verifier_attempt": {
      "attempted": true,
      "channel": "verifier_ready_patch_artifact",
      "patch_artifact_persisted": true,
      "verifier_ready_patch_artifact": true
    },
    "verifier_command": [
      "/Users/chenmohan/gits/barcarolle/experiments/core_narrative/tasks/click/rwork/click__rwork__003/verifier/run.sh"
    ],
    "verifier_digest_sha256": "609e560843b434813d98fc6891fe4834f2ca628bd2c01616f23db26a0fa9f232",
    "workspace_diff": {
      "adapter_unsafe_content_detected": null,
      "candidate_patch_sha256": "a56da14f76815a9bd9be5ca801ff65f92fbf9e407ca51eb340dc66d41dcae38c",
      "candidate_patch_size_bytes": 237,
      "collection_command": [
        "git",
        "diff",
        "--binary",
        "--no-ext-diff",
        "--unified=0",
        "HEAD"
      ],
      "collection_unsafe_content_detected": false,
      "contract": "workspace-diff-v1",
      "patch_artifact_written": true,
      "patch_ready": true,
      "unsafe_content_attribution": null,
      "unsafe_content_detected": false,
      "unsafe_content_source": null,
      "untracked_scope": {
        "checked": true,
        "reserved_count": 2,
        "reserved_paths_sample": [
          ".core_narrative/statement.md",
          ".core_narrative/task.json"
        ],
        "source_count": 0,
        "source_paths_sample": []
      }
    }
  },
  "patch_path": "/Users/chenmohan/gits/barcarolle/experiments/core_narrative/results/raw/m2_5_workspace_diff_synthetic_20260510__cheap-generic-swe__click__rwork__003__attempt1/submission.patch",
  "review": {
    "mergeability_grade": null,
    "notes": "",
    "rule_violation": false,
    "wrong_module": false
  },
  "run_id": "m2_5_workspace_diff_synthetic_20260510__cheap-generic-swe__click__rwork__003__attempt1",
  "schema_version": "core-narrative.run-result.v1",
  "split": "rwork",
  "started_at": "2026-05-10T10:33:36.547681Z",
  "status": "failed",
  "task_id": "click__rwork__003",
  "verification": {
    "duration_seconds": 0.316,
    "exit_code": 1,
    "stderr_artifact": "/Users/chenmohan/gits/barcarolle/experiments/core_narrative/results/raw/m2_5_workspace_diff_synthetic_20260510__cheap-generic-swe__click__rwork__003__attempt1/verifier.stderr.txt",
    "stdout_artifact": "/Users/chenmohan/gits/barcarolle/experiments/core_narrative/results/raw/m2_5_workspace_diff_synthetic_20260510__cheap-generic-swe__click__rwork__003__attempt1/verifier.stdout.txt"
  }
}
