{
  "acut_id": "cheap-generic-swe",
  "attempt": 1,
  "error": null,
  "finished_at": "2026-05-08T01:31:46.211424Z",
  "metadata": {
    "skip_apply": false,
    "timeout_seconds": 60,
    "tool": "apply_and_verify",
    "verifier_command": [
      "/Users/chenmohan/gits/barcarolle/experiments/core_narrative/tasks/click/rbench/click__rbench__003/verifier/run.sh"
    ]
  },
  "patch_path": "/Users/chenmohan/gits/barcarolle/experiments/core_narrative/results/raw/codex_nfl_gate0_preflight_20260508__click__rbench__003__reference_2/submission.patch",
  "review": {
    "mergeability_grade": null,
    "notes": "",
    "rule_violation": false,
    "wrong_module": false
  },
  "run_id": "codex_nfl_gate0_preflight_20260508__click__rbench__003__reference_2",
  "schema_version": "core-narrative.run-result.v1",
  "split": "rbench",
  "started_at": "2026-05-08T01:31:46.008164Z",
  "status": "failed",
  "task_id": "click__rbench__003",
  "verification": {
    "duration_seconds": 0.187,
    "exit_code": 1,
    "stderr_artifact": "/Users/chenmohan/gits/barcarolle/experiments/core_narrative/results/raw/codex_nfl_gate0_preflight_20260508__click__rbench__003__reference_2/verifier.stderr.txt",
    "stdout_artifact": "/Users/chenmohan/gits/barcarolle/experiments/core_narrative/results/raw/codex_nfl_gate0_preflight_20260508__click__rbench__003__reference_2/verifier.stdout.txt"
  }
}
