{
  "acut_id": "cheap-click-specialist",
  "attempt": 1,
  "error": null,
  "finished_at": "2026-05-08T17:26:53.725505Z",
  "metadata": {
    "acut_manifest_path": "/Users/chenmohan/gits/barcarolle/experiments/core_narrative/configs/acuts/cheap-click-specialist.yaml",
    "acut_manifest_sha256": "ea70a0ada77bad7c538dd7ca23340d33762148e55153ca10363a8ae1f2c1b677",
    "batch_tool": "codex_nfl_experiment_runner",
    "clean_patch_replay": {
      "attempted": true,
      "runner_workspace": "/Users/chenmohan/gits/barcarolle/experiments/core_narrative/workspaces/codex_nfl_rwork_live_contract_20260508__cheap-click-specialist__click__rwork__005__attempt1",
      "separate_workspace": true,
      "skip_apply": false,
      "verify_workspace": "/Users/chenmohan/gits/barcarolle/experiments/core_narrative/workspaces/codex_nfl_rwork_live_contract_20260508__cheap-click-specialist__click__rwork__005__attempt1__verify"
    },
    "context_pack_digest": "dfb271ad174531a7dd2f00da4cd0486193d87ce33349380982150889ecf84e48",
    "direct_runner_budget_gate": {
      "allowed": true,
      "approvals_required": [],
      "blockers": [],
      "budget": {
        "current_cumulative_estimated_cost_usd": 24.25934,
        "hard_cap_reached_or_projected": false,
        "hard_cap_usd": 300.0,
        "projected_cost_usd": 1.0,
        "projected_cumulative_estimated_cost_usd": 25.25934,
        "soft_stop_reached_or_projected": false,
        "soft_stop_usd": 240.0
      },
      "default_execution_profile": {
        "core_acut_ids": [
          "frontier-generic-swe",
          "frontier-click-specialist",
          "cheap-generic-swe",
          "cheap-click-specialist"
        ],
        "full_core_requires_coordinator_decision": true,
        "pilot_primary_attempts": 28,
        "primary_attempts_per_acut_task": 1,
        "profile_id": "budget-constrained-2x2-pilot-v2",
        "split_task_limits": {
          "G_score": 2,
          "RBench": 3,
          "RWork": 2
        }
      },
      "env": {
        "all_required_present": true,
        "required": [
          {
            "name": "BARCAROLLE_LLM_API_KEY",
            "present": true
          },
          {
            "name": "BARCAROLLE_LLM_BASE_URL",
            "present": true
          }
        ]
      },
      "execution_request": {
        "acut_id": "cheap-click-specialist",
        "attempt": 1,
        "coordinator_decision_ref_present": true,
        "split": "rwork"
      },
      "ledger": {
        "cumulative_estimated_cost_usd": 24.25934,
        "error_type": null,
        "errors": [],
        "estimated_cost_sum_usd": 24.25934,
        "exists": true,
        "is_file": true,
        "line_count": 115,
        "path": "experiments/core_narrative/results/cost_ledger.jsonl",
        "record_count": 115,
        "writable": true
      },
      "status": "passed",
      "tool": "llm_budget_gate"
    },
    "direct_runner_cost_accounting": {
      "actual_cost_status": "unknown_not_provider_reported",
      "actual_cost_usd": null,
      "estimated_cost_usd": 0.1058,
      "input_tokens": 9594,
      "observed_provider_cost_status": "provider_response_usage_cost_not_invoice",
      "observed_provider_cost_usd": 0.1057995,
      "output_tokens": 21912,
      "provider_usage_reported": true
    },
    "direct_runner_cost_ledger_append": {
      "actual_cost_recorded": false,
      "estimated_cost_usd": 0.1058,
      "new_cumulative_estimated_cost_usd": 24.36514,
      "record_count_after": 116,
      "record_count_before": 115,
      "status": "appended"
    },
    "direct_runner_id": "codex-nfl-direct-search-replace-v1",
    "model_call_made": true,
    "prompt_snapshot": "/Users/chenmohan/gits/barcarolle/experiments/core_narrative/results/raw/codex_nfl_rwork_live_contract_20260508__cheap-click-specialist__click__rwork__005__attempt1/prompt_snapshot.json",
    "prompt_snapshot_sha256": "3358f96ac119d2acb6d40b45faf0aabc0e1c21ff9b76f71ea5088b02fbdb74c3",
    "raw_response_artifact": "/Users/chenmohan/gits/barcarolle/experiments/core_narrative/results/raw/codex_nfl_rwork_live_contract_20260508__cheap-click-specialist__click__rwork__005__attempt1/provider_response.redacted.json",
    "runner_id": "codex-nfl-batch-v1",
    "skip_apply": false,
    "task_manifest_path": "/Users/chenmohan/gits/barcarolle/experiments/core_narrative/tasks/click/rwork/click__rwork__005/task.yaml",
    "task_manifest_sha256": "89ccc3b7b00b1d5972ebdcaacb26b700a6a2e40c996cc9f6384ea5888daa9312",
    "timeout_seconds": 60,
    "tool": "apply_and_verify",
    "verifier_command": [
      "/Users/chenmohan/gits/barcarolle/experiments/core_narrative/tasks/click/rwork/click__rwork__005/verifier/run.sh"
    ],
    "verifier_digest_sha256": "093818211f99e5de9233e85b4aa4586b7ec5832670159352803b21f4d0d66a67"
  },
  "patch_path": "/Users/chenmohan/gits/barcarolle/experiments/core_narrative/results/raw/codex_nfl_rwork_live_contract_20260508__cheap-click-specialist__click__rwork__005__attempt1/submission.patch",
  "review": {
    "mergeability_grade": null,
    "notes": "",
    "rule_violation": false,
    "wrong_module": false
  },
  "run_id": "codex_nfl_rwork_live_contract_20260508__cheap-click-specialist__click__rwork__005__attempt1",
  "schema_version": "core-narrative.run-result.v1",
  "split": "rwork",
  "started_at": "2026-05-08T17:26:53.387446Z",
  "status": "passed",
  "task_id": "click__rwork__005",
  "verification": {
    "duration_seconds": 0.321,
    "exit_code": 0,
    "stderr_artifact": "/Users/chenmohan/gits/barcarolle/experiments/core_narrative/results/raw/codex_nfl_rwork_live_contract_20260508__cheap-click-specialist__click__rwork__005__attempt1/verifier.stderr.txt",
    "stdout_artifact": "/Users/chenmohan/gits/barcarolle/experiments/core_narrative/results/raw/codex_nfl_rwork_live_contract_20260508__cheap-click-specialist__click__rwork__005__attempt1/verifier.stdout.txt"
  }
}
