{
  "acut_id": "cheap-generic-swe",
  "attempt": 1,
  "error": null,
  "finished_at": "2026-05-10T10:00:23.123326Z",
  "metadata": {
    "skip_apply": true,
    "timeout_seconds": 60,
    "tool": "apply_and_verify",
    "verifier_artifacts_redacted": false,
    "verifier_command": [
      "/Users/chenmohan/gits/barcarolle/experiments/core_narrative/tasks/click/rwork/click__rwork__006/verifier/run.sh"
    ]
  },
  "patch_path": "/Users/chenmohan/gits/barcarolle/experiments/core_narrative/results/raw/m2_5_workspace_diff_live_20260510__cheap-generic-swe__click__rwork__006__attempt1/missing_noop.patch",
  "review": {
    "mergeability_grade": null,
    "notes": "",
    "rule_violation": false,
    "wrong_module": false
  },
  "run_id": "m2_5_workspace_diff_live_20260510__cheap-generic-swe__click__rwork__006__attempt1__noop",
  "schema_version": "core-narrative.run-result.v1",
  "split": "rwork",
  "started_at": "2026-05-10T10:00:22.695880Z",
  "status": "failed",
  "task_id": "click__rwork__006",
  "verification": {
    "duration_seconds": 0.427,
    "exit_code": 1,
    "stderr_artifact": "/Users/chenmohan/gits/barcarolle/experiments/core_narrative/results/raw/m2_5_workspace_diff_live_20260510__cheap-generic-swe__click__rwork__006__attempt1/verifier.stderr.txt",
    "stdout_artifact": "/Users/chenmohan/gits/barcarolle/experiments/core_narrative/results/raw/m2_5_workspace_diff_live_20260510__cheap-generic-swe__click__rwork__006__attempt1/verifier.stdout.txt"
  }
}
