{
  "acut_id": "frontier-generic-swe",
  "attempt": 3,
  "error": null,
  "finished_at": "2026-05-08T13:04:31.907233Z",
  "metadata": {
    "skip_apply": true,
    "timeout_seconds": 60,
    "tool": "apply_and_verify",
    "verifier_command": [
      "/Users/chenmohan/gits/barcarolle/experiments/core_narrative/tasks/click/rbench/click__rbench__008/verifier/run.sh"
    ]
  },
  "patch_path": "/Users/chenmohan/gits/barcarolle/experiments/core_narrative/results/raw/codex_nfl_output_contract_v3_click_008_attempt3_prompt_packaging_dryrun_20260508__frontier-generic-swe__click__rbench__008__attempt3/missing_noop.patch",
  "review": {
    "mergeability_grade": null,
    "notes": "",
    "rule_violation": false,
    "wrong_module": false
  },
  "run_id": "codex_nfl_output_contract_v3_click_008_attempt3_prompt_packaging_dryrun_20260508__frontier-generic-swe__click__rbench__008__attempt3__noop",
  "schema_version": "core-narrative.run-result.v1",
  "split": "rbench",
  "started_at": "2026-05-08T13:04:31.556842Z",
  "status": "failed",
  "task_id": "click__rbench__008",
  "verification": {
    "duration_seconds": 0.35,
    "exit_code": 1,
    "stderr_artifact": "/Users/chenmohan/gits/barcarolle/experiments/core_narrative/results/raw/codex_nfl_output_contract_v3_click_008_attempt3_prompt_packaging_dryrun_20260508__frontier-generic-swe__click__rbench__008__attempt3/verifier.stderr.txt",
    "stdout_artifact": "/Users/chenmohan/gits/barcarolle/experiments/core_narrative/results/raw/codex_nfl_output_contract_v3_click_008_attempt3_prompt_packaging_dryrun_20260508__frontier-generic-swe__click__rbench__008__attempt3/verifier.stdout.txt"
  }
}
