{
  "acut_id": "frontier-generic-swe",
  "attempt": 1,
  "error": "patch-generation command exited nonzero without producing a verifier-ready patch",
  "finished_at": "2026-05-06T17:01:14.004231Z",
  "metadata": {
    "adapter_id": "codex-cli-acut-adapter-v0",
    "adapter_status": "command_failed",
    "command_exit_code": 2,
    "command_no_model": false,
    "command_timed_out": false,
    "dry_run": false,
    "failure_class": "nonzero_exit",
    "inner_patch_command": {
      "inner_status": "error",
      "summary_output_arg_present": true,
      "summary_path": "/Users/chenmohan/gits/barcarolle-wt-pilot-009-direct-probe/experiments/core_narrative/results/raw/pilot_009__frontier-generic-swe__click__rbench__001__attempt1/patch_command_summary.json",
      "summary_read": true,
      "tool": "barcarolle_patch_command"
    },
    "ledger_append_status": "appended",
    "model_call_made": true,
    "no_patch_generated": false,
    "patch_size_bytes": 0,
    "tool": "acut_patch_adapter",
    "verifier_ready_patch_available": false
  },
  "patch_path": "experiments/core_narrative/results/raw/pilot_009__frontier-generic-swe__click__rbench__001__attempt1/submission.patch",
  "review": {
    "mergeability_grade": null,
    "notes": "",
    "rule_violation": false,
    "wrong_module": false
  },
  "run_id": "pilot_009__frontier-generic-swe__click__rbench__001__attempt1",
  "schema_version": "core-narrative.run-result.v1",
  "split": "rbench",
  "started_at": "2026-05-06T16:59:59.307202Z",
  "status": "infra_failed",
  "task_id": "click__rbench__001",
  "verification": {
    "duration_seconds": 74.669,
    "exit_code": null,
    "stderr_artifact": "experiments/core_narrative/results/raw/pilot_009__frontier-generic-swe__click__rbench__001__attempt1/adapter.stderr.txt",
    "stdout_artifact": "experiments/core_narrative/results/raw/pilot_009__frontier-generic-swe__click__rbench__001__attempt1/adapter.stdout.txt"
  }
}
