{
  "acut_id": "frontier-click-specialist",
  "attempt": 2,
  "error": null,
  "finished_at": "2026-05-08T10:44:48.032321Z",
  "metadata": {
    "skip_apply": true,
    "timeout_seconds": 60,
    "tool": "apply_and_verify",
    "verifier_command": [
      "/Users/chenmohan/gits/barcarolle/experiments/core_narrative/tasks/click/rbench/click__rbench__008/verifier/run.sh"
    ]
  },
  "patch_path": "/Users/chenmohan/gits/barcarolle/experiments/core_narrative/results/raw/codex_nfl_output_contract_v3_click_005_008_attempt2_20260508__frontier-click-specialist__click__rbench__008__attempt2/missing_noop.patch",
  "review": {
    "mergeability_grade": null,
    "notes": "",
    "rule_violation": false,
    "wrong_module": false
  },
  "run_id": "codex_nfl_output_contract_v3_click_005_008_attempt2_20260508__frontier-click-specialist__click__rbench__008__attempt2__noop",
  "schema_version": "core-narrative.run-result.v1",
  "split": "rbench",
  "started_at": "2026-05-08T10:44:47.703468Z",
  "status": "failed",
  "task_id": "click__rbench__008",
  "verification": {
    "duration_seconds": 0.329,
    "exit_code": 1,
    "stderr_artifact": "/Users/chenmohan/gits/barcarolle/experiments/core_narrative/results/raw/codex_nfl_output_contract_v3_click_005_008_attempt2_20260508__frontier-click-specialist__click__rbench__008__attempt2/verifier.stderr.txt",
    "stdout_artifact": "/Users/chenmohan/gits/barcarolle/experiments/core_narrative/results/raw/codex_nfl_output_contract_v3_click_005_008_attempt2_20260508__frontier-click-specialist__click__rbench__008__attempt2/verifier.stdout.txt"
  }
}
